+ 1 /NodeList/0/DeviceList/1/$ns3::PointToPointNetDevice/TxQueue/Enqueue ns3::PppHeader (Point-to-Point Protocol: IP (0x0021)) ns3::Ipv4Header (tos 0x0 DSCP Default ECN Not-ECT ttl 64 id 0 protocol 6 offset (bytes) 0 flags [none] length: 56 10.1.1.1 > 10.1.4.1) ns3::TcpHeader (49153 > 8080 [SYN] Seq=0 Ack=0 Win=65535 ns3::TcpOptionTS(1000;0) ns3::TcpOptionWinScale(2) ns3::TcpOptionSackPermitted([sack_perm]) ns3::TcpOptionEnd(EOL))
- 1 /NodeList/0/DeviceList/1/$ns3::PointToPointNetDevice/TxQueue/Dequeue ns3::PppHeader (Point-to-Point Protocol: IP (0x0021)) ns3::Ipv4Header (tos 0x0 DSCP Default ECN Not-ECT ttl 64 id 0 protocol 6 offset (bytes) 0 flags [none] length: 56 10.1.1.1 > 10.1.4.1) ns3::TcpHeader (49153 > 8080 [SYN] Seq=0 Ack=0 Win=65535 ns3::TcpOptionTS(1000;0) ns3::TcpOptionWinScale(2) ns3::TcpOptionSackPermitted([sack_perm]) ns3::TcpOptionEnd(EOL))
r 1.00293 /NodeList/4/DeviceList/1/$ns3::PointToPointNetDevice/MacRx ns3::PppHeader (Point-to-Point Protocol: IP (0x0021)) ns3::Ipv4Header (tos 0x0 DSCP Default ECN Not-ECT ttl 64 id 0 protocol 6 offset (bytes) 0 flags [none] length: 56 10.1.1.1 > 10.1.4.1) ns3::TcpHeader (49153 > 8080 [SYN] Seq=0 Ack=0 Win=65535 ns3::TcpOptionTS(1000;0) ns3::TcpOptionWinScale(2) ns3::TcpOptionSackPermitted([sack_perm]) ns3::TcpOptionEnd(EOL))
+ 1.00293 /NodeList/4/DeviceList/3/$ns3::PointToPointNetDevice/TxQueue/Enqueue ns3::PppHeader (Point-to-Point Protocol: IP (0x0021)) ns3::Ipv4Header (tos 0x0 DSCP Default ECN Not-ECT ttl 63 id 0 protocol 6 offset (bytes) 0 flags [none] length: 56 10.1.1.1 > 10.1.4.1) ns3::TcpHeader (49153 > 8080 [SYN] Seq=0 Ack=0 Win=65535 ns3::TcpOptionTS(1000;0) ns3::TcpOptionWinScale(2) ns3::TcpOptionSackPermitted([sack_perm]) ns3::TcpOptionEnd(EOL))
- 1.00293 /NodeList/4/DeviceList/3/$ns3::PointToPointNetDevice/TxQueue/Dequeue ns3::PppHeader (Point-to-Point Protocol: IP (0x0021)) ns3::Ipv4Header (tos 0x0 DSCP Default ECN Not-ECT ttl 63 id 0 protocol 6 offset (bytes) 0 flags [none] length: 56 10.1.1.1 > 10.1.4.1) ns3::TcpHeader (49153 > 8080 [SYN] Seq=0 Ack=0 Win=65535 ns3::TcpOptionTS(1000;0) ns3::TcpOptionWinScale(2) ns3::TcpOptionSackPermitted([sack_perm]) ns3::TcpOptionEnd(EOL))
r 1.00586 /NodeList/5/DeviceList/1/$ns3::PointToPointNetDevice/MacRx ns3::PppHeader (Point-to-Point Protocol: IP (0x0021)) ns3::Ipv4Header (tos 0x0 DSCP Default ECN Not-ECT ttl 63 id 0 protocol 6 offset (bytes) 0 flags [none] length: 56 10.1.1.1 > 10.1.4.1) ns3::TcpHeader (49153 > 8080 [SYN] Seq=0 Ack=0 Win=65535 ns3::TcpOptionTS(1000;0) ns3::TcpOptionWinScale(2) ns3::TcpOptionSackPermitted([sack_perm]) ns3::TcpOptionEnd(EOL))
+ 1.00586 /NodeList/5/DeviceList/2/$ns3::PointToPointNetDevice/TxQueue/Enqueue ns3::PppHeader (Point-to-Point Protocol: IP (0x0021)) ns3::Ipv4Header (tos 0x0 DSCP Default ECN Not-ECT ttl 62 id 0 protocol 6 offset (bytes) 0 flags [none] length: 56 10.1.1.1 > 10.1.4.1) ns3::TcpHeader (49153 > 8080 [SYN] Seq=0 Ack=0 Win=65535 ns3::TcpOptionTS(1000;0) ns3::TcpOptionWinScale(2) ns3::TcpOptionSackPermitted([sack_perm]) ns3::TcpOptionEnd(EOL))
- 1.00586 /NodeList/5/DeviceList/2/$ns3::PointToPointNetDevice/TxQueue/Dequeue ns3::PppHeader (Point-to-Point Protocol: IP (0x0021)) ns3::Ipv4Header (tos 0x0 DSCP Default ECN Not-ECT ttl 62 id 0 protocol 6 offset (bytes) 0 flags [none] length: 56 10.1.1.1 > 10.1.4.1) ns3::TcpHeader (49153 > 8080 [SYN] Seq=0 Ack=0 Win=65535 ns3::TcpOptionTS(1000;0) ns3::TcpOptionWinScale(2) ns3::TcpOptionSackPermitted([sack_perm]) ns3::TcpOptionEnd(EOL))
r 1.00878 /NodeList/2/DeviceList/1/$ns3::PointToPointNetDevice/MacRx ns3::PppHeader (Point-to-Point Protocol: IP (0x0021)) ns3::Ipv4Header (tos 0x0 DSCP Default ECN Not-ECT ttl 62 id 0 protocol 6 offset (bytes) 0 flags [none] length: 56 10.1.1.1 > 10.1.4.1) ns3::TcpHeader (49153 > 8080 [SYN] Seq=0 Ack=0 Win=65535 ns3::TcpOptionTS(1000;0) ns3::TcpOptionWinScale(2) ns3::TcpOptionSackPermitted([sack_perm]) ns3::TcpOptionEnd(EOL))
+ 1.00878 /NodeList/2/DeviceList/1/$ns3::PointToPointNetDevice/TxQueue/Enqueue ns3::PppHeader (Point-to-Point Protocol: IP (0x0021)) ns3::Ipv4Header (tos 0x0 DSCP Default ECN Not-ECT ttl 64 id 0 protocol 6 offset (bytes) 0 flags [none] length: 56 10.1.4.1 > 10.1.1.1) ns3::TcpHeader (8080 > 49153 [SYN|ACK] Seq=0 Ack=1 Win=65535 ns3::TcpOptionTS(1008;1000) ns3::TcpOptionWinScale(2) ns3::TcpOptionSackPermitted([sack_perm]) ns3::TcpOptionEnd(EOL))
- 1.00878 /NodeList/2/DeviceList/1/$ns3::PointToPointNetDevice/TxQueue/Dequeue ns3::PppHeader (Point-to-Point Protocol: IP (0x0021)) ns3::Ipv4Header (tos 0x0 DSCP Default ECN Not-ECT ttl 64 id 0 protocol 6 offset (bytes) 0 flags [none] length: 56 10.1.4.1 > 10.1.1.1) ns3::TcpHeader (8080 > 49153 [SYN|ACK] Seq=0 Ack=1 Win=65535 ns3::TcpOptionTS(1008;1000) ns3::TcpOptionWinScale(2) ns3::TcpOptionSackPermitted([sack_perm]) ns3::TcpOptionEnd(EOL))
r 1.01171 /NodeList/5/DeviceList/2/$ns3::PointToPointNetDevice/MacRx ns3::PppHeader (Point-to-Point Protocol: IP (0x0021)) ns3::Ipv4Header (tos 0x0 DSCP Default ECN Not-ECT ttl 64 id 0 protocol 6 offset (bytes) 0 flags [none] length: 56 10.1.4.1 > 10.1.1.1) ns3::TcpHeader (8080 > 49153 [SYN|ACK] Seq=0 Ack=1 Win=65535 ns3::TcpOptionTS(1008;1000) ns3::TcpOptionWinScale(2) ns3::TcpOptionSackPermitted([sack_perm]) ns3::TcpOptionEnd(EOL))
+ 1.01171 /NodeList/5/DeviceList/1/$ns3::PointToPointNetDevice/TxQueue/Enqueue ns3::PppHeader (Point-to-Point Protocol: IP (0x0021)) ns3::Ipv4Header (tos 0x0 DSCP Default ECN Not-ECT ttl 63 id 0 protocol 6 offset (bytes) 0 flags [none] length: 56 10.1.4.1 > 10.1.1.1) ns3::TcpHeader (8080 > 49153 [SYN|ACK] Seq=0 Ack=1 Win=65535 ns3::TcpOptionTS(1008;1000) ns3::TcpOptionWinScale(2) ns3::TcpOptionSackPermitted([sack_perm]) ns3::TcpOptionEnd(EOL))
- 1.01171 /NodeList/5/DeviceList/1/$ns3::PointToPointNetDevice/TxQueue/Dequeue ns3::PppHeader (Point-to-Point Protocol: IP (0x0021)) ns3::Ipv4Header (tos 0x0 DSCP Default ECN Not-ECT ttl 63 id 0 protocol 6 offset (bytes) 0 flags [none] length: 56 10.1.4.1 > 10.1.1.1) ns3::TcpHeader (8080 > 49153 [SYN|ACK] Seq=0 Ack=1 Win=65535 ns3::TcpOptionTS(1008;1000) ns3::TcpOptionWinScale(2) ns3::TcpOptionSackPermitted([sack_perm]) ns3::TcpOptionEnd(EOL))
r 1.01464 /NodeList/4/DeviceList/3/$ns3::PointToPointNetDevice/MacRx ns3::PppHeader (Point-to-Point Protocol: IP (0x0021)) ns3::Ipv4Header (tos 0x0 DSCP Default ECN Not-ECT ttl 63 id 0 protocol 6 offset (bytes) 0 flags [none] length: 56 10.1.4.1 > 10.1.1.1) ns3::TcpHeader (8080 > 49153 [SYN|ACK] Seq=0 Ack=1 Win=65535 ns3::TcpOptionTS(1008;1000) ns3::TcpOptionWinScale(2) ns3::TcpOptionSackPermitted([sack_perm]) ns3::TcpOptionEnd(EOL))
+ 1.01464 /NodeList/4/DeviceList/1/$ns3::PointToPointNetDevice/TxQueue/Enqueue ns3::PppHeader (Point-to-Point Protocol: IP (0x0021)) ns3::Ipv4Header (tos 0x0 DSCP Default ECN Not-ECT ttl 62 id 0 protocol 6 offset (bytes) 0 flags [none] length: 56 10.1.4.1 > 10.1.1.1) ns3::TcpHeader (8080 > 49153 [SYN|ACK] Seq=0 Ack=1 Win=65535 ns3::TcpOptionTS(1008;1000) ns3::TcpOptionWinScale(2) ns3::TcpOptionSackPermitted([sack_perm]) ns3::TcpOptionEnd(EOL))
- 1.01464 /NodeList/4/DeviceList/1/$ns3::PointToPointNetDevice/TxQueue/Dequeue ns3::PppHeader (Point-to-Point Protocol: IP (0x0021)) ns3::Ipv4Header (tos 0x0 DSCP Default ECN Not-ECT ttl 62 id 0 protocol 6 offset (bytes) 0 flags [none] length: 56 10.1.4.1 > 10.1.1.1) ns3::TcpHeader (8080 > 49153 [SYN|ACK] Seq=0 Ack=1 Win=65535 ns3::TcpOptionTS(1008;1000) ns3::TcpOptionWinScale(2) ns3::TcpOptionSackPermitted([sack_perm]) ns3::TcpOptionEnd(EOL))
r 1.01757 /NodeList/0/DeviceList/1/$ns3::PointToPointNetDevice/MacRx ns3::PppHeader (Point-to-Point Protocol: IP (0x0021)) ns3::Ipv4Header (tos 0x0 DSCP Default ECN Not-ECT ttl 62 id 0 protocol 6 offset (bytes) 0 flags [none] length: 56 10.1.4.1 > 10.1.1.1) ns3::TcpHeader (8080 > 49153 [SYN|ACK] Seq=0 Ack=1 Win=65535 ns3::TcpOptionTS(1008;1000) ns3::TcpOptionWinScale(2) ns3::TcpOptionSackPermitted([sack_perm]) ns3::TcpOptionEnd(EOL))
+ 1.01757 /NodeList/0/DeviceList/1/$ns3::PointToPointNetDevice/TxQueue/Enqueue ns3::PppHeader (Point-to-Point Protocol: IP (0x0021)) ns3::Ipv4Header (tos 0x0 DSCP Default ECN Not-ECT ttl 64 id 1 protocol 6 offset (bytes) 0 flags [none] length: 52 10.1.1.1 > 10.1.4.1) ns3::TcpHeader (49153 > 8080 [ACK] Seq=1 Ack=1 Win=32768 ns3::TcpOptionTS(1017;1008) ns3::TcpOptionEnd(EOL))
- 1.01757 /NodeList/0/DeviceList/1/$ns3::PointToPointNetDevice/TxQueue/Dequeue ns3::PppHeader (Point-to-Point Protocol: IP (0x0021)) ns3::Ipv4Header (tos 0x0 DSCP Default ECN Not-ECT ttl 64 id 1 protocol 6 offset (bytes) 0 flags [none] length: 52 10.1.1.1 > 10.1.4.1) ns3::TcpHeader (49153 > 8080 [ACK] Seq=1 Ack=1 Win=32768 ns3::TcpOptionTS(1017;1008) ns3::TcpOptionEnd(EOL))
+ 1.01757 /NodeList/0/DeviceList/1/$ns3::PointToPointNetDevice/TxQueue/Enqueue ns3::PppHeader (Point-to-Point Protocol: IP (0x0021)) ns3::Ipv4Header (tos 0x0 DSCP Default ECN Not-ECT ttl 64 id 2 protocol 6 offset (bytes) 0 flags [none] length: 588 10.1.1.1 > 10.1.4.1) ns3::TcpHeader (49153 > 8080 [ACK] Seq=1 Ack=1 Win=32768 ns3::TcpOptionTS(1017;1008) ns3::TcpOptionEnd(EOL)) Payload Fragment [0:536]
- 1.01843 /NodeList/0/DeviceList/1/$ns3::PointToPointNetDevice/TxQueue/Dequeue ns3::PppHeader (Point-to-Point Protocol: IP (0x0021)) ns3::Ipv4Header (tos 0x0 DSCP Default ECN Not-ECT ttl 64 id 2 protocol 6 offset (bytes) 0 flags [none] length: 588 10.1.1.1 > 10.1.4.1) ns3::TcpHeader (49153 > 8080 [ACK] Seq=1 Ack=1 Win=32768 ns3::TcpOptionTS(1017;1008) ns3::TcpOptionEnd(EOL)) Payload Fragment [0:536]
r 1.02043 /NodeList/4/DeviceList/1/$ns3::PointToPointNetDevice/MacRx ns3::PppHeader (Point-to-Point Protocol: IP (0x0021)) ns3::Ipv4Header (tos 0x0 DSCP Default ECN Not-ECT ttl 64 id 1 protocol 6 offset (bytes) 0 flags [none] length: 52 10.1.1.1 > 10.1.4.1) ns3::TcpHeader (49153 > 8080 [ACK] Seq=1 Ack=1 Win=32768 ns3::TcpOptionTS(1017;1008) ns3::TcpOptionEnd(EOL))
+ 1.02043 /NodeList/4/DeviceList/3/$ns3::PointToPointNetDevice/TxQueue/Enqueue ns3::PppHeader (Point-to-Point Protocol: IP (0x0021)) ns3::Ipv4Header (tos 0x0 DSCP Default ECN Not-ECT ttl 63 id 1 protocol 6 offset (bytes) 0 flags [none] length: 52 10.1.1.1 > 10.1.4.1) ns3::TcpHeader (49153 > 8080 [ACK] Seq=1 Ack=1 Win=32768 ns3::TcpOptionTS(1017;1008) ns3::TcpOptionEnd(EOL))
- 1.02043 /NodeList/4/DeviceList/3/$ns3::PointToPointNetDevice/TxQueue/Dequeue ns3::PppHeader (Point-to-Point Protocol: IP (0x0021)) ns3::Ipv4Header (tos 0x0 DSCP Default ECN Not-ECT ttl 63 id 1 protocol 6 offset (bytes) 0 flags [none] length: 52 10.1.1.1 > 10.1.4.1) ns3::TcpHeader (49153 > 8080 [ACK] Seq=1 Ack=1 Win=32768 ns3::TcpOptionTS(1017;1008) ns3::TcpOptionEnd(EOL))
r 1.0233 /NodeList/5/DeviceList/1/$ns3::PointToPointNetDevice/MacRx ns3::PppHeader (Point-to-Point Protocol: IP (0x0021)) ns3::Ipv4Header (tos 0x0 DSCP Default ECN Not-ECT ttl 63 id 1 protocol 6 offset (bytes) 0 flags [none] length: 52 10.1.1.1 > 10.1.4.1) ns3::TcpHeader (49153 > 8080 [ACK] Seq=1 Ack=1 Win=32768 ns3::TcpOptionTS(1017;1008) ns3::TcpOptionEnd(EOL))
+ 1.0233 /NodeList/5/DeviceList/2/$ns3::PointToPointNetDevice/TxQueue/Enqueue ns3::PppHeader (Point-to-Point Protocol: IP (0x0021)) ns3::Ipv4Header (tos 0x0 DSCP Default ECN Not-ECT ttl 62 id 1 protocol 6 offset (bytes) 0 flags [none] length: 52 10.1.1.1 > 10.1.4.1) ns3::TcpHeader (49153 > 8080 [ACK] Seq=1 Ack=1 Win=32768 ns3::TcpOptionTS(1017;1008) ns3::TcpOptionEnd(EOL))
- 1.0233 /NodeList/5/DeviceList/2/$ns3::PointToPointNetDevice/TxQueue/Dequeue ns3::PppHeader (Point-to-Point Protocol: IP (0x0021)) ns3::Ipv4Header (tos 0x0 DSCP Default ECN Not-ECT ttl 62 id 1 protocol 6 offset (bytes) 0 flags [none] length: 52 10.1.1.1 > 10.1.4.1) ns3::TcpHeader (49153 > 8080 [ACK] Seq=1 Ack=1 Win=32768 ns3::TcpOptionTS(1017;1008) ns3::TcpOptionEnd(EOL))
r 1.02616 /NodeList/2/DeviceList/1/$ns3::PointToPointNetDevice/MacRx ns3::PppHeader (Point-to-Point Protocol: IP (0x0021)) ns3::Ipv4Header (tos 0x0 DSCP Default ECN Not-ECT ttl 62 id 1 protocol 6 offset (bytes) 0 flags [none] length: 52 10.1.1.1 > 10.1.4.1) ns3::TcpHeader (49153 > 8080 [ACK] Seq=1 Ack=1 Win=32768 ns3::TcpOptionTS(1017;1008) ns3::TcpOptionEnd(EOL))
r 1.02987 /NodeList/4/DeviceList/1/$ns3::PointToPointNetDevice/MacRx ns3::PppHeader (Point-to-Point Protocol: IP (0x0021)) ns3::Ipv4Header (tos 0x0 DSCP Default ECN Not-ECT ttl 64 id 2 protocol 6 offset (bytes) 0 flags [none] length: 588 10.1.1.1 > 10.1.4.1) ns3::TcpHeader (49153 > 8080 [ACK] Seq=1 Ack=1 Win=32768 ns3::TcpOptionTS(1017;1008) ns3::TcpOptionEnd(EOL)) Payload Fragment [0:536]
+ 1.02987 /NodeList/4/DeviceList/3/$ns3::PointToPointNetDevice/TxQueue/Enqueue ns3::PppHeader (Point-to-Point Protocol: IP (0x0021)) ns3::Ipv4Header (tos 0x0 DSCP Default ECN Not-ECT ttl 63 id 2 protocol 6 offset (bytes) 0 flags [none] length: 588 10.1.1.1 > 10.1.4.1) ns3::TcpHeader (49153 > 8080 [ACK] Seq=1 Ack=1 Win=32768 ns3::TcpOptionTS(1017;1008) ns3::TcpOptionEnd(EOL)) Payload Fragment [0:536]
- 1.02987 /NodeList/4/DeviceList/3/$ns3::PointToPointNetDevice/TxQueue/Dequeue ns3::PppHeader (Point-to-Point Protocol: IP (0x0021)) ns3::Ipv4Header (tos 0x0 DSCP Default ECN Not-ECT ttl 63 id 2 protocol 6 offset (bytes) 0 flags [none] length: 588 10.1.1.1 > 10.1.4.1) ns3::TcpHeader (49153 > 8080 [ACK] Seq=1 Ack=1 Win=32768 ns3::TcpOptionTS(1017;1008) ns3::TcpOptionEnd(EOL)) Payload Fragment [0:536]
r 1.04131 /NodeList/5/DeviceList/1/$ns3::PointToPointNetDevice/MacRx ns3::PppHeader (Point-to-Point Protocol: IP (0x0021)) ns3::Ipv4Header (tos 0x0 DSCP Default ECN Not-ECT ttl 63 id 2 protocol 6 offset (bytes) 0 flags [none] length: 588 10.1.1.1 > 10.1.4.1) ns3::TcpHeader (49153 > 8080 [ACK] Seq=1 Ack=1 Win=32768 ns3::TcpOptionTS(1017;1008) ns3::TcpOptionEnd(EOL)) Payload Fragment [0:536]
+ 1.04131 /NodeList/5/DeviceList/2/$ns3::PointToPointNetDevice/TxQueue/Enqueue ns3::PppHeader (Point-to-Point Protocol: IP (0x0021)) ns3::Ipv4Header (tos 0x0 DSCP Default ECN Not-ECT ttl 62 id 2 protocol 6 offset (bytes) 0 flags [none] length: 588 10.1.1.1 > 10.1.4.1) ns3::TcpHeader (49153 > 8080 [ACK] Seq=1 Ack=1 Win=32768 ns3::TcpOptionTS(1017;1008) ns3::TcpOptionEnd(EOL)) Payload Fragment [0:536]
- 1.04131 /NodeList/5/DeviceList/2/$ns3::PointToPointNetDevice/TxQueue/Dequeue ns3::PppHeader (Point-to-Point Protocol: IP (0x0021)) ns3::Ipv4Header (tos 0x0 DSCP Default ECN Not-ECT ttl 62 id 2 protocol 6 offset (bytes) 0 flags [none] length: 588 10.1.1.1 > 10.1.4.1) ns3::TcpHeader (49153 > 8080 [ACK] Seq=1 Ack=1 Win=32768 ns3::TcpOptionTS(1017;1008) ns3::TcpOptionEnd(EOL)) Payload Fragment [0:536]
r 1.05275 /NodeList/2/DeviceList/1/$ns3::PointToPointNetDevice/MacRx ns3::PppHeader (Point-to-Point Protocol: IP (0x0021)) ns3::Ipv4Header (tos 0x0 DSCP Default ECN Not-ECT ttl 62 id 2 protocol 6 offset (bytes) 0 flags [none] length: 588 10.1.1.1 > 10.1.4.1) ns3::TcpHeader (49153 > 8080 [ACK] Seq=1 Ack=1 Win=32768 ns3::TcpOptionTS(1017;1008) ns3::TcpOptionEnd(EOL)) Payload Fragment [0:536]
+ 1.05275 /NodeList/2/DeviceList/1/$ns3::PointToPointNetDevice/TxQueue/Enqueue ns3::PppHeader (Point-to-Point Protocol: IP (0x0021)) ns3::Ipv4Header (tos 0x0 DSCP Default ECN Not-ECT ttl 64 id 1 protocol 6 offset (bytes) 0 flags [none] length: 52 10.1.4.1 > 10.1.1.1) ns3::TcpHeader (8080 > 49153 [ACK] Seq=1 Ack=537 Win=32768 ns3::TcpOptionTS(1052;1017) ns3::TcpOptionEnd(EOL))
- 1.05275 /NodeList/2/DeviceList/1/$ns3::PointToPointNetDevice/TxQueue/Dequeue ns3::PppHeader (Point-to-Point Protocol: IP (0x0021)) ns3::Ipv4Header (tos 0x0 DSCP Default ECN Not-ECT ttl 64 id 1 protocol 6 offset (bytes) 0 flags [none] length: 52 10.1.4.1 > 10.1.1.1) ns3::TcpHeader (8080 > 49153 [ACK] Seq=1 Ack=537 Win=32768 ns3::TcpOptionTS(1052;1017) ns3::TcpOptionEnd(EOL))
r 1.05562 /NodeList/5/DeviceList/2/$ns3::PointToPointNetDevice/MacRx ns3::PppHeader (Point-to-Point Protocol: IP (0x0021)) ns3::Ipv4Header (tos 0x0 DSCP Default ECN Not-ECT ttl 64 id 1 protocol 6 offset (bytes) 0 flags [none] length: 52 10.1.4.1 > 10.1.1.1) ns3::TcpHeader (8080 > 49153 [ACK] Seq=1 Ack=537 Win=32768 ns3::TcpOptionTS(1052;1017) ns3::TcpOptionEnd(EOL))
+ 1.05562 /NodeList/5/DeviceList/1/$ns3::PointToPointNetDevice/TxQueue/Enqueue ns3::PppHeader (Point-to-Point Protocol: IP (0x0021)) ns3::Ipv4Header (tos 0x0 DSCP Default ECN Not-ECT ttl 63 id 1 protocol 6 offset (bytes) 0 flags [none] length: 52 10.1.4.1 > 10.1.1.1) ns3::TcpHeader (8080 > 49153 [ACK] Seq=1 Ack=537 Win=32768 ns3::TcpOptionTS(1052;1017) ns3::TcpOptionEnd(EOL))
- 1.05562 /NodeList/5/DeviceList/1/$ns3::PointToPointNetDevice/TxQueue/Dequeue ns3::PppHeader (Point-to-Point Protocol: IP (0x0021)) ns3::Ipv4Header (tos 0x0 DSCP Default ECN Not-ECT ttl 63 id 1 protocol 6 offset (bytes) 0 flags [none] length: 52 10.1.4.1 > 10.1.1.1) ns3::TcpHeader (8080 > 49153 [ACK] Seq=1 Ack=537 Win=32768 ns3::TcpOptionTS(1052;1017) ns3::TcpOptionEnd(EOL))
r 1.05848 /NodeList/4/DeviceList/3/$ns3::PointToPointNetDevice/MacRx ns3::PppHeader (Point-to-Point Protocol: IP (0x0021)) ns3::Ipv4Header (tos 0x0 DSCP Default ECN Not-ECT ttl 63 id 1 protocol 6 offset (bytes) 0 flags [none] length: 52 10.1.4.1 > 10.1.1.1) ns3::TcpHeader (8080 > 49153 [ACK] Seq=1 Ack=537 Win=32768 ns3::TcpOptionTS(1052;1017) ns3::TcpOptionEnd(EOL))
+ 1.05848 /NodeList/4/DeviceList/1/$ns3::PointToPointNetDevice/TxQueue/Enqueue ns3::PppHeader (Point-to-Point Protocol: IP (0x0021)) ns3::Ipv4Header (tos 0x0 DSCP Default ECN Not-ECT ttl 62 id 1 protocol 6 offset (bytes) 0 flags [none] length: 52 10.1.4.1 > 10.1.1.1) ns3::TcpHeader (8080 > 49153 [ACK] Seq=1 Ack=537 Win=32768 ns3::TcpOptionTS(1052;1017) ns3::TcpOptionEnd(EOL))
- 1.05848 /NodeList/4/DeviceList/1/$ns3::PointToPointNetDevice/TxQueue/Dequeue ns3::PppHeader (Point-to-Point Protocol: IP (0x0021)) ns3::Ipv4Header (tos 0x0 DSCP Default ECN Not-ECT ttl 62 id 1 protocol 6 offset (bytes) 0 flags [none] length: 52 10.1.4.1 > 10.1.1.1) ns3::TcpHeader (8080 > 49153 [ACK] Seq=1 Ack=537 Win=32768 ns3::TcpOptionTS(1052;1017) ns3::TcpOptionEnd(EOL))
r 1.06134 /NodeList/0/DeviceList/1/$ns3::PointToPointNetDevice/MacRx ns3::PppHeader (Point-to-Point Protocol: IP (0x0021)) ns3::Ipv4Header (tos 0x0 DSCP Default ECN Not-ECT ttl 62 id 1 protocol 6 offset (bytes) 0 flags [none] length: 52 10.1.4.1 > 10.1.1.1) ns3::TcpHeader (8080 > 49153 [ACK] Seq=1 Ack=537 Win=32768 ns3::TcpOptionTS(1052;1017) ns3::TcpOptionEnd(EOL))
+ 1.06134 /NodeList/0/DeviceList/1/$ns3::PointToPointNetDevice/TxQueue/Enqueue ns3::PppHeader (Point-to-Point Protocol: IP (0x0021)) ns3::Ipv4Header (tos 0x0 DSCP Default ECN Not-ECT ttl 64 id 3 protocol 6 offset (bytes) 0 flags [none] length: 588 10.1.1.1 > 10.1.4.1) ns3::TcpHeader (49153 > 8080 [ACK] Seq=537 Ack=1 Win=32768 ns3::TcpOptionTS(1061;1052) ns3::TcpOptionEnd(EOL)) Payload Fragment [536:1040] Payload Fragment [0:32]
- 1.06134 /NodeList/0/DeviceList/1/$ns3::PointToPointNetDevice/TxQueue/Dequeue ns3::PppHeader (Point-to-Point Protocol: IP (0x0021)) ns3::Ipv4Header (tos 0x0 DSCP Default ECN Not-ECT ttl 64 id 3 protocol 6 offset (bytes) 0 flags [none] length: 588 10.1.1.1 > 10.1.4.1) ns3::TcpHeader (49153 > 8080 [ACK] Seq=537 Ack=1 Win=32768 ns3::TcpOptionTS(1061;1052) ns3::TcpOptionEnd(EOL)) Payload Fragment [536:1040] Payload Fragment [0:32]
+ 1.06134 /NodeList/0/DeviceList/1/$ns3::PointToPointNetDevice/TxQueue/Enqueue ns3::PppHeader (Point-to-Point Protocol: IP (0x0021)) ns3::Ipv4Header (tos 0x0 DSCP Default ECN Not-ECT ttl 64 id 4 protocol 6 offset (bytes) 0 flags [none] length: 588 10.1.1.1 > 10.1.4.1) ns3::TcpHeader (49153 > 8080 [ACK] Seq=1073 Ack=1 Win=32768 ns3::TcpOptionTS(1061;1052) ns3::TcpOptionEnd(EOL)) Payload Fragment [32:568]
- 1.07078 /NodeList/0/DeviceList/1/$ns3::PointToPointNetDevice/TxQueue/Dequeue ns3::PppHeader (Point-to-Point Protocol: IP (0x0021)) ns3::Ipv4Header (tos 0x0 DSCP Default ECN Not-ECT ttl 64 id 4 protocol 6 offset (bytes) 0 flags [none] length: 588 10.1.1.1 > 10.1.4.1) ns3::TcpHeader (49153 > 8080 [ACK] Seq=1073 Ack=1 Win=32768 ns3::TcpOptionTS(1061;1052) ns3::TcpOptionEnd(EOL)) Payload Fragment [32:568]
r 1.07278 /NodeList/4/DeviceList/1/$ns3::PointToPointNetDevice/MacRx ns3::PppHeader (Point-to-Point Protocol: IP (0x0021)) ns3::Ipv4Header (tos 0x0 DSCP Default ECN Not-ECT ttl 64 id 3 protocol 6 offset (bytes) 0 flags [none] length: 588 10.1.1.1 > 10.1.4.1) ns3::TcpHeader (49153 > 8080 [ACK] Seq=537 Ack=1 Win=32768 ns3::TcpOptionTS(1061;1052) ns3::TcpOptionEnd(EOL)) Payload Fragment [536:1040] Payload Fragment [0:32]
+ 1.07278 /NodeList/4/DeviceList/3/$ns3::PointToPointNetDevice/TxQueue/Enqueue ns3::PppHeader (Point-to-Point Protocol: IP (0x0021)) ns3::Ipv4Header (tos 0x0 DSCP Default ECN Not-ECT ttl 63 id 3 protocol 6 offset (bytes) 0 flags [none] length: 588 10.1.1.1 > 10.1.4.1) ns3::TcpHeader (49153 > 8080 [ACK] Seq=537 Ack=1 Win=32768 ns3::TcpOptionTS(1061;1052) ns3::TcpOptionEnd(EOL)) Payload Fragment [536:1040] Payload Fragment [0:32]
- 1.07278 /NodeList/4/DeviceList/3/$ns3::PointToPointNetDevice/TxQueue/Dequeue ns3::PppHeader (Point-to-Point Protocol: IP (0x0021)) ns3::Ipv4Header (tos 0x0 DSCP Default ECN Not-ECT ttl 63 id 3 protocol 6 offset (bytes) 0 flags [none] length: 588 10.1.1.1 > 10.1.4.1) ns3::TcpHeader (49153 > 8080 [ACK] Seq=537 Ack=1 Win=32768 ns3::TcpOptionTS(1061;1052) ns3::TcpOptionEnd(EOL)) Payload Fragment [536:1040] Payload Fragment [0:32]
r 1.08222 /NodeList/4/DeviceList/1/$ns3::PointToPointNetDevice/MacRx ns3::PppHeader (Point-to-Point Protocol: IP (0x0021)) ns3::Ipv4Header (tos 0x0 DSCP Default ECN Not-ECT ttl 64 id 4 protocol 6 offset (bytes) 0 flags [none] length: 588 10.1.1.1 > 10.1.4.1) ns3::TcpHeader (49153 > 8080 [ACK] Seq=1073 Ack=1 Win=32768 ns3::TcpOptionTS(1061;1052) ns3::TcpOptionEnd(EOL)) Payload Fragment [32:568]
+ 1.08222 /NodeList/4/DeviceList/3/$ns3::PointToPointNetDevice/TxQueue/Enqueue ns3::PppHeader (Point-to-Point Protocol: IP (0x0021)) ns3::Ipv4Header (tos 0x0 DSCP Default ECN Not-ECT ttl 63 id 4 protocol 6 offset (bytes) 0 flags [none] length: 588 10.1.1.1 > 10.1.4.1) ns3::TcpHeader (49153 > 8080 [ACK] Seq=1073 Ack=1 Win=32768 ns3::TcpOptionTS(1061;1052) ns3::TcpOptionEnd(EOL)) Payload Fragment [32:568]
- 1.08222 /NodeList/4/DeviceList/3/$ns3::PointToPointNetDevice/TxQueue/Dequeue ns3::PppHeader (Point-to-Point Protocol: IP (0x0021)) ns3::Ipv4Header (tos 0x0 DSCP Default ECN Not-ECT ttl 63 id 4 protocol 6 offset (bytes) 0 flags [none] length: 588 10.1.1.1 > 10.1.4.1) ns3::TcpHeader (49153 > 8080 [ACK] Seq=1073 Ack=1 Win=32768 ns3::TcpOptionTS(1061;1052) ns3::TcpOptionEnd(EOL)) Payload Fragment [32:568]
r 1.08422 /NodeList/5/DeviceList/1/$ns3::PointToPointNetDevice/MacRx ns3::PppHeader (Point-to-Point Protocol: IP (0x0021)) ns3::Ipv4Header (tos 0x0 DSCP Default ECN Not-ECT ttl 63 id 3 protocol 6 offset (bytes) 0 flags [none] length: 588 10.1.1.1 > 10.1.4.1) ns3::TcpHeader (49153 > 8080 [ACK] Seq=537 Ack=1 Win=32768 ns3::TcpOptionTS(1061;1052) ns3::TcpOptionEnd(EOL)) Payload Fragment [536:1040] Payload Fragment [0:32]
+ 1.08422 /NodeList/5/DeviceList/2/$ns3::PointToPointNetDevice/TxQueue/Enqueue ns3::PppHeader (Point-to-Point Protocol: IP (0x0021)) ns3::Ipv4Header (tos 0x0 DSCP Default ECN Not-ECT ttl 62 id 3 protocol 6 offset (bytes) 0 flags [none] length: 588 10.1.1.1 > 10.1.4.1) ns3::TcpHeader (49153 > 8080 [ACK] Seq=537 Ack=1 Win=32768 ns3::TcpOptionTS(1061;1052) ns3::TcpOptionEnd(EOL)) Payload Fragment [536:1040] Payload Fragment [0:32]
- 1.08422 /NodeList/5/DeviceList/2/$ns3::PointToPointNetDevice/TxQueue/Dequeue ns3::PppHeader (Point-to-Point Protocol: IP (0x0021)) ns3::Ipv4Header (tos 0x0 DSCP Default ECN Not-ECT ttl 62 id 3 protocol 6 offset (bytes) 0 flags [none] length: 588 10.1.1.1 > 10.1.4.1) ns3::TcpHeader (49153 > 8080 [ACK] Seq=537 Ack=1 Win=32768 ns3::TcpOptionTS(1061;1052) ns3::TcpOptionEnd(EOL)) Payload Fragment [536:1040] Payload Fragment [0:32]
r 1.09366 /NodeList/5/DeviceList/1/$ns3::PointToPointNetDevice/MacRx ns3::PppHeader (Point-to-Point Protocol: IP (0x0021)) ns3::Ipv4Header (tos 0x0 DSCP Default ECN Not-ECT ttl 63 id 4 protocol 6 offset (bytes) 0 flags [none] length: 588 10.1.1.1 > 10.1.4.1) ns3::TcpHeader (49153 > 8080 [ACK] Seq=1073 Ack=1 Win=32768 ns3::TcpOptionTS(1061;1052) ns3::TcpOptionEnd(EOL)) Payload Fragment [32:568]
+ 1.09366 /NodeList/5/DeviceList/2/$ns3::PointToPointNetDevice/TxQueue/Enqueue ns3::PppHeader (Point-to-Point Protocol: IP (0x0021)) ns3::Ipv4Header (tos 0x0 DSCP Default ECN Not-ECT ttl 62 id 4 protocol 6 offset (bytes) 0 flags [none] length: 588 10.1.1.1 > 10.1.4.1) ns3::TcpHeader (49153 > 8080 [ACK] Seq=1073 Ack=1 Win=32768 ns3::TcpOptionTS(1061;1052) ns3::TcpOptionEnd(EOL)) Payload Fragment [32:568]
- 1.09366 /NodeList/5/DeviceList/2/$ns3::PointToPointNetDevice/TxQueue/Dequeue ns3::PppHeader (Point-to-Point Protocol: IP (0x0021)) ns3::Ipv4Header (tos 0x0 DSCP Default ECN Not-ECT ttl 62 id 4 protocol 6 offset (bytes) 0 flags [none] length: 588 10.1.1.1 > 10.1.4.1) ns3::TcpHeader (49153 > 8080 [ACK] Seq=1073 Ack=1 Win=32768 ns3::TcpOptionTS(1061;1052) ns3::TcpOptionEnd(EOL)) Payload Fragment [32:568]
r 1.09566 /NodeList/2/DeviceList/1/$ns3::PointToPointNetDevice/MacRx ns3::PppHeader (Point-to-Point Protocol: IP (0x0021)) ns3::Ipv4Header (tos 0x0 DSCP Default ECN Not-ECT ttl 62 id 3 protocol 6 offset (bytes) 0 flags [none] length: 588 10.1.1.1 > 10.1.4.1) ns3::TcpHeader (49153 > 8080 [ACK] Seq=537 Ack=1 Win=32768 ns3::TcpOptionTS(1061;1052) ns3::TcpOptionEnd(EOL)) Payload Fragment [536:1040] Payload Fragment [0:32]
r 1.1051 /NodeList/2/DeviceList/1/$ns3::PointToPointNetDevice/MacRx ns3::PppHeader (Point-to-Point Protocol: IP (0x0021)) ns3::Ipv4Header (tos 0x0 DSCP Default ECN Not-ECT ttl 62 id 4 protocol 6 offset (bytes) 0 flags [none] length: 588 10.1.1.1 > 10.1.4.1) ns3::TcpHeader (49153 > 8080 [ACK] Seq=1073 Ack=1 Win=32768 ns3::TcpOptionTS(1061;1052) ns3::TcpOptionEnd(EOL)) Payload Fragment [32:568]
+ 1.1051 /NodeList/2/DeviceList/1/$ns3::PointToPointNetDevice/TxQueue/Enqueue ns3::PppHeader (Point-to-Point Protocol: IP (0x0021)) ns3::Ipv4Header (tos 0x0 DSCP Default ECN Not-ECT ttl 64 id 2 protocol 6 offset (bytes) 0 flags [none] length: 52 10.1.4.1 > 10.1.1.1) ns3::TcpHeader (8080 > 49153 [ACK] Seq=1 Ack=1609 Win=32768 ns3::TcpOptionTS(1105;1061) ns3::TcpOptionEnd(EOL))
- 1.1051 /NodeList/2/DeviceList/1/$ns3::PointToPointNetDevice/TxQueue/Dequeue ns3::PppHeader (Point-to-Point Protocol: IP (0x0021)) ns3::Ipv4Header (tos 0x0 DSCP Default ECN Not-ECT ttl 64 id 2 protocol 6 offset (bytes) 0 flags [none] length: 52 10.1.4.1 > 10.1.1.1) ns3::TcpHeader (8080 > 49153 [ACK] Seq=1 Ack=1609 Win=32768 ns3::TcpOptionTS(1105;1061) ns3::TcpOptionEnd(EOL))
r 1.10797 /NodeList/5/DeviceList/2/$ns3::PointToPointNetDevice/MacRx ns3::PppHeader (Point-to-Point Protocol: IP (0x0021)) ns3::Ipv4Header (tos 0x0 DSCP Default ECN Not-ECT ttl 64 id 2 protocol 6 offset (bytes) 0 flags [none] length: 52 10.1.4.1 > 10.1.1.1) ns3::TcpHeader (8080 > 49153 [ACK] Seq=1 Ack=1609 Win=32768 ns3::TcpOptionTS(1105;1061) ns3::TcpOptionEnd(EOL))
+ 1.10797 /NodeList/5/DeviceList/1/$ns3::PointToPointNetDevice/TxQueue/Enqueue ns3::PppHeader (Point-to-Point Protocol: IP (0x0021)) ns3::Ipv4Header (tos 0x0 DSCP Default ECN Not-ECT ttl 63 id 2 protocol 6 offset (bytes) 0 flags [none] length: 52 10.1.4.1 > 10.1.1.1) ns3::TcpHeader (8080 > 49153 [ACK] Seq=1 Ack=1609 Win=32768 ns3::TcpOptionTS(1105;1061) ns3::TcpOptionEnd(EOL))
- 1.10797 /NodeList/5/DeviceList/1/$ns3::PointToPointNetDevice/TxQueue/Dequeue ns3::PppHeader (Point-to-Point Protocol: IP (0x0021)) ns3::Ipv4Header (tos 0x0 DSCP Default ECN Not-ECT ttl 63 id 2 protocol 6 offset (bytes) 0 flags [none] length: 52 10.1.4.1 > 10.1.1.1) ns3::TcpHeader (8080 > 49153 [ACK] Seq=1 Ack=1609 Win=32768 ns3::TcpOptionTS(1105;1061) ns3::TcpOptionEnd(EOL))
r 1.11083 /NodeList/4/DeviceList/3/$ns3::PointToPointNetDevice/MacRx ns3::PppHeader (Point-to-Point Protocol: IP (0x0021)) ns3::Ipv4Header (tos 0x0 DSCP Default ECN Not-ECT ttl 63 id 2 protocol 6 offset (bytes) 0 flags [none] length: 52 10.1.4.1 > 10.1.1.1) ns3::TcpHeader (8080 > 49153 [ACK] Seq=1 Ack=1609 Win=32768 ns3::TcpOptionTS(1105;1061) ns3::TcpOptionEnd(EOL))
+ 1.11083 /NodeList/4/DeviceList/1/$ns3::PointToPointNetDevice/TxQueue/Enqueue ns3::PppHeader (Point-to-Point Protocol: IP (0x0021)) ns3::Ipv4Header (tos 0x0 DSCP Default ECN Not-ECT ttl 62 id 2 protocol 6 offset (bytes) 0 flags [none] length: 52 10.1.4.1 > 10.1.1.1) ns3::TcpHeader (8080 > 49153 [ACK] Seq=1 Ack=1609 Win=32768 ns3::TcpOptionTS(1105;1061) ns3::TcpOptionEnd(EOL))
- 1.11083 /NodeList/4/DeviceList/1/$ns3::PointToPointNetDevice/TxQueue/Dequeue ns3::PppHeader (Point-to-Point Protocol: IP (0x0021)) ns3::Ipv4Header (tos 0x0 DSCP Default ECN Not-ECT ttl 62 id 2 protocol 6 offset (bytes) 0 flags [none] length: 52 10.1.4.1 > 10.1.1.1) ns3::TcpHeader (8080 > 49153 [ACK] Seq=1 Ack=1609 Win=32768 ns3::TcpOptionTS(1105;1061) ns3::TcpOptionEnd(EOL))
r 1.1137 /NodeList/0/DeviceList/1/$ns3::PointToPointNetDevice/MacRx ns3::PppHeader (Point-to-Point Protocol: IP (0x0021)) ns3::Ipv4Header (tos 0x0 DSCP Default ECN Not-ECT ttl 62 id 2 protocol 6 offset (bytes) 0 flags [none] length: 52 10.1.4.1 > 10.1.1.1) ns3::TcpHeader (8080 > 49153 [ACK] Seq=1 Ack=1609 Win=32768 ns3::TcpOptionTS(1105;1061) ns3::TcpOptionEnd(EOL))
+ 1.1137 /NodeList/0/DeviceList/1/$ns3::PointToPointNetDevice/TxQueue/Enqueue ns3::PppHeader (Point-to-Point Protocol: IP (0x0021)) ns3::Ipv4Header (tos 0x0 DSCP Default ECN Not-ECT ttl 64 id 5 protocol 6 offset (bytes) 0 flags [none] length: 588 10.1.1.1 > 10.1.4.1) ns3::TcpHeader (49153 > 8080 [ACK] Seq=1609 Ack=1 Win=32768 ns3::TcpOptionTS(1113;1105) ns3::TcpOptionEnd(EOL)) Payload Fragment [568:1040] Payload Fragment [0:64]
- 1.1137 /NodeList/0/DeviceList/1/$ns3::PointToPointNetDevice/TxQueue/Dequeue ns3::PppHeader (Point-to-Point Protocol: IP (0x0021)) ns3::Ipv4Header (tos 0x0 DSCP Default ECN Not-ECT ttl 64 id 5 protocol 6 offset (bytes) 0 flags [none] length: 588 10.1.1.1 > 10.1.4.1) ns3::TcpHeader (49153 > 8080 [ACK] Seq=1609 Ack=1 Win=32768 ns3::TcpOptionTS(1113;1105) ns3::TcpOptionEnd(EOL)) Payload Fragment [568:1040] Payload Fragment [0:64]
+ 1.1137 /NodeList/0/DeviceList/1/$ns3::PointToPointNetDevice/TxQueue/Enqueue ns3::PppHeader (Point-to-Point Protocol: IP (0x0021)) ns3::Ipv4Header (tos 0x0 DSCP Default ECN Not-ECT ttl 64 id 6 protocol 6 offset (bytes) 0 flags [none] length: 588 10.1.1.1 > 10.1.4.1) ns3::TcpHeader (49153 > 8080 [ACK] Seq=2145 Ack=1 Win=32768 ns3::TcpOptionTS(1113;1105) ns3::TcpOptionEnd(EOL)) Payload Fragment [64:600]
+ 1.1137 /NodeList/0/DeviceList/1/$ns3::PointToPointNetDevice/TxQueue/Enqueue ns3::PppHeader (Point-to-Point Protocol: IP (0x0021)) ns3::Ipv4Header (tos 0x0 DSCP Default ECN Not-ECT ttl 64 id 7 protocol 6 offset (bytes) 0 flags [none] length: 588 10.1.1.1 > 10.1.4.1) ns3::TcpHeader (49153 > 8080 [ACK] Seq=2681 Ack=1 Win=32768 ns3::TcpOptionTS(1113;1105) ns3::TcpOptionEnd(EOL)) Payload Fragment [600:1040] Payload Fragment [0:96]
- 1.12314 /NodeList/0/DeviceList/1/$ns3::PointToPointNetDevice/TxQueue/Dequeue ns3::PppHeader (Point-to-Point Protocol: IP (0x0021)) ns3::Ipv4Header (tos 0x0 DSCP Default ECN Not-ECT ttl 64 id 6 protocol 6 offset (bytes) 0 flags [none] length: 588 10.1.1.1 > 10.1.4.1) ns3::TcpHeader (49153 > 8080 [ACK] Seq=2145 Ack=1 Win=32768 ns3::TcpOptionTS(1113;1105) ns3::TcpOptionEnd(EOL)) Payload Fragment [64:600]
r 1.12514 /NodeList/4/DeviceList/1/$ns3::PointToPointNetDevice/MacRx ns3::PppHeader (Point-to-Point Protocol: IP (0x0021)) ns3::Ipv4Header (tos 0x0 DSCP Default ECN Not-ECT ttl 64 id 5 protocol 6 offset (bytes) 0 flags [none] length: 588 10.1.1.1 > 10.1.4.1) ns3::TcpHeader (49153 > 8080 [ACK] Seq=1609 Ack=1 Win=32768 ns3::TcpOptionTS(1113;1105) ns3::TcpOptionEnd(EOL)) Payload Fragment [568:1040] Payload Fragment [0:64]
+ 1.12514 /NodeList/4/DeviceList/3/$ns3::PointToPointNetDevice/TxQueue/Enqueue ns3::PppHeader (Point-to-Point Protocol: IP (0x0021)) ns3::Ipv4Header (tos 0x0 DSCP Default ECN Not-ECT ttl 63 id 5 protocol 6 offset (bytes) 0 flags [none] length: 588 10.1.1.1 > 10.1.4.1) ns3::TcpHeader (49153 > 8080 [ACK] Seq=1609 Ack=1 Win=32768 ns3::TcpOptionTS(1113;1105) ns3::TcpOptionEnd(EOL)) Payload Fragment [568:1040] Payload Fragment [0:64]
- 1.12514 /NodeList/4/DeviceList/3/$ns3::PointToPointNetDevice/TxQueue/Dequeue ns3::PppHeader (Point-to-Point Protocol: IP (0x0021)) ns3::Ipv4Header (tos 0x0 DSCP Default ECN Not-ECT ttl 63 id 5 protocol 6 offset (bytes) 0 flags [none] length: 588 10.1.1.1 > 10.1.4.1) ns3::TcpHeader (49153 > 8080 [ACK] Seq=1609 Ack=1 Win=32768 ns3::TcpOptionTS(1113;1105) ns3::TcpOptionEnd(EOL)) Payload Fragment [568:1040] Payload Fragment [0:64]
- 1.13258 /NodeList/0/DeviceList/1/$ns3::PointToPointNetDevice/TxQueue/Dequeue ns3::PppHeader (Point-to-Point Protocol: IP (0x0021)) ns3::Ipv4Header (tos 0x0 DSCP Default ECN Not-ECT ttl 64 id 7 protocol 6 offset (bytes) 0 flags [none] length: 588 10.1.1.1 > 10.1.4.1) ns3::TcpHeader (49153 > 8080 [ACK] Seq=2681 Ack=1 Win=32768 ns3::TcpOptionTS(1113;1105) ns3::TcpOptionEnd(EOL)) Payload Fragment [600:1040] Payload Fragment [0:96]
r 1.13458 /NodeList/4/DeviceList/1/$ns3::PointToPointNetDevice/MacRx ns3::PppHeader (Point-to-Point Protocol: IP (0x0021)) ns3::Ipv4Header (tos 0x0 DSCP Default ECN Not-ECT ttl 64 id 6 protocol 6 offset (bytes) 0 flags [none] length: 588 10.1.1.1 > 10.1.4.1) ns3::TcpHeader (49153 > 8080 [ACK] Seq=2145 Ack=1 Win=32768 ns3::TcpOptionTS(1113;1105) ns3::TcpOptionEnd(EOL)) Payload Fragment [64:600]
+ 1.13458 /NodeList/4/DeviceList/3/$ns3::PointToPointNetDevice/TxQueue/Enqueue ns3::PppHeader (Point-to-Point Protocol: IP (0x0021)) ns3::Ipv4Header (tos 0x0 DSCP Default ECN Not-ECT ttl 63 id 6 protocol 6 offset (bytes) 0 flags [none] length: 588 10.1.1.1 > 10.1.4.1) ns3::TcpHeader (49153 > 8080 [ACK] Seq=2145 Ack=1 Win=32768 ns3::TcpOptionTS(1113;1105) ns3::TcpOptionEnd(EOL)) Payload Fragment [64:600]
- 1.13458 /NodeList/4/DeviceList/3/$ns3::PointToPointNetDevice/TxQueue/Dequeue ns3::PppHeader (Point-to-Point Protocol: IP (0x0021)) ns3::Ipv4Header (tos 0x0 DSCP Default ECN Not-ECT ttl 63 id 6 protocol 6 offset (bytes) 0 flags [none] length: 588 10.1.1.1 > 10.1.4.1) ns3::TcpHeader (49153 > 8080 [ACK] Seq=2145 Ack=1 Win=32768 ns3::TcpOptionTS(1113;1105) ns3::TcpOptionEnd(EOL)) Payload Fragment [64:600]
r 1.13658 /NodeList/5/DeviceList/1/$ns3::PointToPointNetDevice/MacRx ns3::PppHeader (Point-to-Point Protocol: IP (0x0021)) ns3::Ipv4Header (tos 0x0 DSCP Default ECN Not-ECT ttl 63 id 5 protocol 6 offset (bytes) 0 flags [none] length: 588 10.1.1.1 > 10.1.4.1) ns3::TcpHeader (49153 > 8080 [ACK] Seq=1609 Ack=1 Win=32768 ns3::TcpOptionTS(1113;1105) ns3::TcpOptionEnd(EOL)) Payload Fragment [568:1040] Payload Fragment [0:64]
+ 1.13658 /NodeList/5/DeviceList/2/$ns3::PointToPointNetDevice/TxQueue/Enqueue ns3::PppHeader (Point-to-Point Protocol: IP (0x0021)) ns3::Ipv4Header (tos 0x0 DSCP Default ECN Not-ECT ttl 62 id 5 protocol 6 offset (bytes) 0 flags [none] length: 588 10.1.1.1 > 10.1.4.1) ns3::TcpHeader (49153 > 8080 [ACK] Seq=1609 Ack=1 Win=32768 ns3::TcpOptionTS(1113;1105) ns3::TcpOptionEnd(EOL)) Payload Fragment [568:1040] Payload Fragment [0:64]
- 1.13658 /NodeList/5/DeviceList/2/$ns3::PointToPointNetDevice/TxQueue/Dequeue ns3::PppHeader (Point-to-Point Protocol: IP (0x0021)) ns3::Ipv4Header (tos 0x0 DSCP Default ECN Not-ECT ttl 62 id 5 protocol 6 offset (bytes) 0 flags [none] length: 588 10.1.1.1 > 10.1.4.1) ns3::TcpHeader (49153 > 8080 [ACK] Seq=1609 Ack=1 Win=32768 ns3::TcpOptionTS(1113;1105) ns3::TcpOptionEnd(EOL)) Payload Fragment [568:1040] Payload Fragment [0:64]
r 1.14402 /NodeList/4/DeviceList/1/$ns3::PointToPointNetDevice/MacRx ns3::PppHeader (Point-to-Point Protocol: IP (0x0021)) ns3::Ipv4Header (tos 0x0 DSCP Default ECN Not-ECT ttl 64 id 7 protocol 6 offset (bytes) 0 flags [none] length: 588 10.1.1.1 > 10.1.4.1) ns3::TcpHeader (49153 > 8080 [ACK] Seq=2681 Ack=1 Win=32768 ns3::TcpOptionTS(1113;1105) ns3::TcpOptionEnd(EOL)) Payload Fragment [600:1040] Payload Fragment [0:96]
+ 1.14402 /NodeList/4/DeviceList/3/$ns3::PointToPointNetDevice/TxQueue/Enqueue ns3::PppHeader (Point-to-Point Protocol: IP (0x0021)) ns3::Ipv4Header (tos 0x0 DSCP Default ECN Not-ECT ttl 63 id 7 protocol 6 offset (bytes) 0 flags [none] length: 588 10.1.1.1 > 10.1.4.1) ns3::TcpHeader (49153 > 8080 [ACK] Seq=2681 Ack=1 Win=32768 ns3::TcpOptionTS(1113;1105) ns3::TcpOptionEnd(EOL)) Payload Fragment [600:1040] Payload Fragment [0:96]
- 1.14402 /NodeList/4/DeviceList/3/$ns3::PointToPointNetDevice/TxQueue/Dequeue ns3::PppHeader (Point-to-Point Protocol: IP (0x0021)) ns3::Ipv4Header (tos 0x0 DSCP Default ECN Not-ECT ttl 63 id 7 protocol 6 offset (bytes) 0 flags [none] length: 588 10.1.1.1 > 10.1.4.1) ns3::TcpHeader (49153 > 8080 [ACK] Seq=2681 Ack=1 Win=32768 ns3::TcpOptionTS(1113;1105) ns3::TcpOptionEnd(EOL)) Payload Fragment [600:1040] Payload Fragment [0:96]
r 1.14602 /NodeList/5/DeviceList/1/$ns3::PointToPointNetDevice/MacRx ns3::PppHeader (Point-to-Point Protocol: IP (0x0021)) ns3::Ipv4Header (tos 0x0 DSCP Default ECN Not-ECT ttl 63 id 6 protocol 6 offset (bytes) 0 flags [none] length: 588 10.1.1.1 > 10.1.4.1) ns3::TcpHeader (49153 > 8080 [ACK] Seq=2145 Ack=1 Win=32768 ns3::TcpOptionTS(1113;1105) ns3::TcpOptionEnd(EOL)) Payload Fragment [64:600]
+ 1.14602 /NodeList/5/DeviceList/2/$ns3::PointToPointNetDevice/TxQueue/Enqueue ns3::PppHeader (Point-to-Point Protocol: IP (0x0021)) ns3::Ipv4Header (tos 0x0 DSCP Default ECN Not-ECT ttl 62 id 6 protocol 6 offset (bytes) 0 flags [none] length: 588 10.1.1.1 > 10.1.4.1) ns3::TcpHeader (49153 > 8080 [ACK] Seq=2145 Ack=1 Win=32768 ns3::TcpOptionTS(1113;1105) ns3::TcpOptionEnd(EOL)) Payload Fragment [64:600]
- 1.14602 /NodeList/5/DeviceList/2/$ns3::PointToPointNetDevice/TxQueue/Dequeue ns3::PppHeader (Point-to-Point Protocol: IP (0x0021)) ns3::Ipv4Header (tos 0x0 DSCP Default ECN Not-ECT ttl 62 id 6 protocol 6 offset (bytes) 0 flags [none] length: 588 10.1.1.1 > 10.1.4.1) ns3::TcpHeader (49153 > 8080 [ACK] Seq=2145 Ack=1 Win=32768 ns3::TcpOptionTS(1113;1105) ns3::TcpOptionEnd(EOL)) Payload Fragment [64:600]
r 1.14802 /NodeList/2/DeviceList/1/$ns3::PointToPointNetDevice/MacRx ns3::PppHeader (Point-to-Point Protocol: IP (0x0021)) ns3::Ipv4Header (tos 0x0 DSCP Default ECN Not-ECT ttl 62 id 5 protocol 6 offset (bytes) 0 flags [none] length: 588 10.1.1.1 > 10.1.4.1) ns3::TcpHeader (49153 > 8080 [ACK] Seq=1609 Ack=1 Win=32768 ns3::TcpOptionTS(1113;1105) ns3::TcpOptionEnd(EOL)) Payload Fragment [568:1040] Payload Fragment [0:64]
r 1.15546 /NodeList/5/DeviceList/1/$ns3::PointToPointNetDevice/MacRx ns3::PppHeader (Point-to-Point Protocol: IP (0x0021)) ns3::Ipv4Header (tos 0x0 DSCP Default ECN Not-ECT ttl 63 id 7 protocol 6 offset (bytes) 0 flags [none] length: 588 10.1.1.1 > 10.1.4.1) ns3::TcpHeader (49153 > 8080 [ACK] Seq=2681 Ack=1 Win=32768 ns3::TcpOptionTS(1113;1105) ns3::TcpOptionEnd(EOL)) Payload Fragment [600:1040] Payload Fragment [0:96]
+ 1.15546 /NodeList/5/DeviceList/2/$ns3::PointToPointNetDevice/TxQueue/Enqueue ns3::PppHeader (Point-to-Point Protocol: IP (0x0021)) ns3::Ipv4Header (tos 0x0 DSCP Default ECN Not-ECT ttl 62 id 7 protocol 6 offset (bytes) 0 flags [none] length: 588 10.1.1.1 > 10.1.4.1) ns3::TcpHeader (49153 > 8080 [ACK] Seq=2681 Ack=1 Win=32768 ns3::TcpOptionTS(1113;1105) ns3::TcpOptionEnd(EOL)) Payload Fragment [600:1040] Payload Fragment [0:96]
- 1.15546 /NodeList/5/DeviceList/2/$ns3::PointToPointNetDevice/TxQueue/Dequeue ns3::PppHeader (Point-to-Point Protocol: IP (0x0021)) ns3::Ipv4Header (tos 0x0 DSCP Default ECN Not-ECT ttl 62 id 7 protocol 6 offset (bytes) 0 flags [none] length: 588 10.1.1.1 > 10.1.4.1) ns3::TcpHeader (49153 > 8080 [ACK] Seq=2681 Ack=1 Win=32768 ns3::TcpOptionTS(1113;1105) ns3::TcpOptionEnd(EOL)) Payload Fragment [600:1040] Payload Fragment [0:96]
